{
  "call": {
    "call_id": "call-minseung-20261015-012301",
    "started_at": "2026-10-15T01:23:05+09:00",
    "started_by": "person",
    "topic": null,
    "title": "맥북 에어와 프로, 코딩용으로 뭐가 나을까",
    "title_source": "summary",
    "state": "ended",
    "duration_s": 460,
    "continues": null,
    "marks": {
      "report": true,
      "table": true,
      "chart": true,
      "bee_writes": 1
    }
  },
  "why_calling": null,
  "prep": {
    "note": "오늘 아침 회의에서 노트북 이야기를 했고, 한국 가격을 궁금해했어요. 9월 28일부터 남은 일: 아이폰과 애플워치에 Bee 설정하기.",
    "looked_up": [
      {
        "type": "conversation",
        "summary": "성현 님과의 대화",
        "at": "2026-10-13T18:40:00+09:00"
      },
      {
        "type": "day",
        "date": "2026-10-15"
      }
    ],
    "from_bee": true
  },
  "items": [
    {
      "type": "speech",
      "id": "speech-9",
      "at": "2026-10-15T01:23:08+09:00",
      "speaker": "ai",
      "text": "안녕하세요, 민승 님. 오늘 밤엔 무슨 이야기 할까요?",
      "interrupted": false
    },
    {
      "type": "speech",
      "id": "speech-14",
      "at": "2026-10-15T01:23:14+09:00",
      "speaker": "person",
      "text": "토요일 촬영 장소를 아직 못 정했어요. 그거 할 일로 넣어 줄래요?",
      "interrupted": false
    },
    {
      "type": "speech",
      "id": "speech-19",
      "at": "2026-10-15T01:23:21+09:00",
      "speaker": "ai",
      "text": "Bee 할 일에 '토요일 촬영 장소 정하기'를 넣을까요?",
      "interrupted": false
    },
    {
      "type": "speech",
      "id": "speech-24",
      "at": "2026-10-15T01:23:27+09:00",
      "speaker": "person",
      "text": "네, 넣어 주세요.",
      "interrupted": false
    },
    {
      "type": "bee_write",
      "id": "write-w1",
      "at": "2026-10-15T01:23:30+09:00",
      "kind": "todo_create",
      "text": "토요일 촬영 장소 정하기",
      "state": "written",
      "will_retry": false,
      "undoable": false
    },
    {
      "type": "speech",
      "id": "speech-29",
      "at": "2026-10-15T01:23:32+09:00",
      "speaker": "ai",
      "text": "넣었어요. 오늘 아침 회의에서 노트북 이야기를 하셨던데, 정하셨어요?",
      "interrupted": false
    },
    {
      "type": "speech",
      "id": "speech-35",
      "at": "2026-10-15T01:23:42+09:00",
      "speaker": "person",
      "text": "아직이요. 지금 노트북이 너무 느려서 바꾸긴 해야 하는데, 뭘 살지 모르겠어요.",
      "interrupted": false
    },
    {
      "type": "speech",
      "id": "speech-41",
      "at": "2026-10-15T01:24:03+09:00",
      "speaker": "ai",
      "text": "요즘 어떤 게 제일 불편하세요?",
      "interrupted": false
    },
    {
      "type": "speech",
      "id": "speech-46",
      "at": "2026-10-15T01:24:11+09:00",
      "speaker": "person",
      "text": "배터리가 금방 닳고 무거워서 들고 다니기가 힘들어요. 도서관에 매일 가지고 가거든요.",
      "interrupted": false
    },
    {
      "type": "speech",
      "id": "speech-53",
      "at": "2026-10-15T01:24:46+09:00",
      "speaker": "ai",
      "text": "매일 들고 다니시면 무게랑 배터리가 중요하겠네요. 생각해 두신 모델이 있어요?",
      "interrupted": false
    },
    {
      "type": "speech",
      "id": "speech-60",
      "at": "2026-10-15T01:25:23+09:00",
      "speaker": "person",
      "text": "맥북 에어랑 프로 중에 코딩용으로 고민 중이에요. 한국 가격 비교해 주고, 저한테 뭐가 맞는지 알려 주세요.",
      "interrupted": false
    },
    {
      "type": "speech",
      "id": "speech-66",
      "at": "2026-10-15T01:25:35+09:00",
      "speaker": "ai",
      "text": "좋아요. 한국 가격이랑 배터리 시간을 찾아볼게요.",
      "interrupted": false
    },
    {
      "type": "speech",
      "id": "speech-75",
      "at": "2026-10-15T01:26:10+09:00",
      "speaker": "person",
      "text": "얼마나 걸려요?",
      "interrupted": false
    },
    {
      "type": "speech",
      "id": "speech-81",
      "at": "2026-10-15T01:26:37+09:00",
      "speaker": "ai",
      "text": "지금 애플 한국 가격표를 보고 있어요. 주로 어떤 코딩을 하세요?",
      "interrupted": false
    },
    {
      "type": "speech",
      "id": "speech-86",
      "at": "2026-10-15T01:26:43+09:00",
      "speaker": "person",
      "text": "주로 파이썬이고 머신러닝도 조금 해요. 도서관이나 카페에서 일할 때가 많아요.",
      "interrupted": false
    },
    {
      "type": "job",
      "id": "job-01",
      "at": "2026-10-15T01:27:03+09:00",
      "title": "코딩용 맥북 에어와 프로 한국 가격 비교",
      "state": "done",
      "started_at": "2026-10-15T01:25:36+09:00",
      "duration_s": 87,
      "step": null,
      "summary": "애플 한국 기준 에어는 1,590,000원, 프로는 2,390,000원부터예요. 파이썬과 가벼운 머신러닝을 밖에서 한다면 배터리와 무게에서 에어가 낫고, 프로는 노트북에서 모델을 학습시킬 때만 값을 해요.",
      "files": [
        {
          "name": "price-chart.svg",
          "kind": "chart",
          "url": "/calls/call-minseung-20261015-012301/files/jobs/01/price-chart.svg",
          "title": "한국 가격(원), 에어와 프로, 세 가지 구성",
          "image_url": "/calls/call-minseung-20261015-012301/files/jobs/01/price-chart.png",
          "image_url_dark": "/calls/call-minseung-20261015-012301/files/jobs/01/price-chart-dark.png"
        },
        {
          "name": "report.md",
          "kind": "report",
          "url": "/calls/call-minseung-20261015-012301/files/jobs/01/report.md",
          "title": null,
          "image_url": null,
          "image_url_dark": null
        },
        {
          "name": "comparison.csv",
          "kind": "table",
          "url": "/calls/call-minseung-20261015-012301/files/jobs/01/comparison.csv",
          "title": null,
          "image_url": null,
          "image_url_dark": null
        }
      ],
      "failure": null
    },
    {
      "type": "speech",
      "id": "speech-104",
      "at": "2026-10-15T01:27:05+09:00",
      "speaker": "ai",
      "text": "그럼 들고 다니기 좋은 게 중요하겠네요. 에어는 159만 원부터, 프로는 239만 원부터예요. 노트북에서 모델을 직접 학습시키는 게 아니라면 에어가 더 잘 맞아요.",
      "interrupted": false
    },
    {
      "type": "speech",
      "id": "speech-117",
      "at": "2026-10-15T01:28:05+09:00",
      "speaker": "person",
      "text": "그럼 에어로 할게요. 보고서는 이따 볼게요.",
      "interrupted": false
    },
    {
      "type": "speech",
      "id": "speech-122",
      "at": "2026-10-15T01:28:13+09:00",
      "speaker": "ai",
      "text": "좋아요. 보고서랑 비교표는 앱에 있어요. 더 이야기할 거 있으세요?",
      "interrupted": false
    },
    {
      "type": "speech",
      "id": "speech-130",
      "at": "2026-10-15T01:28:35+09:00",
      "speaker": "person",
      "text": "아, 토요일 촬영은 몇 시였죠?",
      "interrupted": false
    },
    {
      "type": "speech",
      "id": "speech-135",
      "at": "2026-10-15T01:28:43+09:00",
      "speaker": "ai",
      "text": "Bee 기록으로는 성현 님과 오전 10시로 이야기하셨어요. 장소는 아직 정하지 않으셨고요.",
      "interrupted": false
    },
    {
      "type": "speech",
      "id": "speech-151",
      "at": "2026-10-15T01:30:15+09:00",
      "speaker": "person",
      "text": "알겠어요. 장소는 내일 성현이랑 정할게요. 오늘은 여기까지 할게요. 고마워요.",
      "interrupted": false
    },
    {
      "type": "speech",
      "id": "speech-156",
      "at": "2026-10-15T01:30:33+09:00",
      "speaker": "ai",
      "text": "네, 민승 님. 좋은 밤 보내세요.",
      "interrupted": false
    }
  ],
  "captions_included": {
    "person": 12,
    "ai": 11
  },
  "version": "7f0373b5ed6752fb"
}
